ʔ̚ k ə ʔ̚ ʔ̚ ⁰	ʔ w a ɴ ⁵⁵
s r a ⁵⁵	s r a ⁵⁵
s a ¹¹	s a ¹¹
ˀb w ɛ ⁵⁵	p w ɛ ⁵⁵
ˀb ɔ ɴ ⁵⁵	ˀb ɔ ɴ ⁵⁵
b l ei ⁵⁵	b l ei ⁵⁵
k l o ŋ ¹¹	k l ə ŋ ¹¹
l a ŋ ¹¹	l̥ a ŋ ¹¹
cʰ ə ŋ ⁵⁵	cʰ ə ŋ ⁵⁵
k a ʔ̚ ⁰	l a ʔ̚ ³³
p l a ¹¹	p l a ¹¹
kʰ w i ⁵¹	kʰ w i t ⁵¹
n o ŋ ⁵⁵	n o ŋ ⁵⁵
j ai ⁵⁵	j ai ⁵⁵
p l o m ¹¹	p l o m ¹¹
cʰ a ɴ ¹¹	cʰ j a ɴ ¹¹
tʰ w w ə n ⁵⁵	tʰ w ɨ ɴ ⁵⁵
s ei ¹¹	s r ei ¹¹
kʰ l i ⁵⁵	kʰ l i ʔ ⁵¹
kʰ r a ¹¹	g r a ¹¹
tʰ a ŋ ⁵⁵	tʰ a ŋ ⁵⁵
p l o ŋ ¹¹	p l o ŋ ¹¹
m j i ɴ ⁵⁵	ˀm i n ⁵⁵
kʰ j o ʔ̚ ⁵¹	kʰ r o ʔ ⁵¹
tʰ a ⁵⁵	tʰ a ⁵⁵
k ə ʔ̚ ⁰	k ə ⁰
cʰ r ou ¹¹	cʰ r ou ¹¹
l o ŋ ¹¹	l o ŋ ¹¹
m ɛ ¹¹	m w ɛ ¹¹
n ə ŋ ⁵⁵	n ɨ ŋ ⁵⁵
j ɛ ʔ̚ ⁵¹	j ɛ ʔ ⁵¹
pʰ ɔ ⁵⁵	pʰ ɔ ⁵⁵
kʰ l ei ⁵⁵	kʰ l ei ⁵⁵
k ə ⁰	k ə ⁰
b ə ¹¹	p ə ¹¹
c ə ¹¹	ɟ i ¹¹
ʔ u ⁵⁵	ʔ u ⁵⁵
g a ŋ ⁵¹	g a ŋ ⁵⁵
cʰ u ɴ ¹¹	cʰ u ɴ ¹¹
l ei ⁵⁵	l ei ⁵⁵
k ə ⁰	p ə ⁰
ˀb a ⁵⁵	ˀb a ⁵⁵
m e ¹¹	m e ¹¹
cʰ a ɴ ¹¹	cʰ a ɴ ¹¹
n̥ w ɛ ¹¹	n̥ w ɛ ¹¹
ˀd w ɛ ¹¹	ˀd w ɛ ¹¹
l a ʔ̚ ⁵¹	l a ʔ̚ ⁵¹
s ə ɴ ¹¹	s w ɨ n ¹¹
ʔ a ⁵⁵	ʔ a ⁵⁵
n o k̚ ⁵¹	n o k̚ ⁵¹
pʰ w i ⁵⁵	pʰ w i ⁵⁵
b ə ŋ ⁵⁵	b ə ŋ ⁵⁵
s ɨ ¹¹	s w ɨ ɴ ¹¹
pʰ ou ⁵⁵	pʰ ou ⁵⁵
pʰ a ¹¹	pʰ a ¹¹
ˀb a ŋ ¹¹	ˀb a ŋ ¹¹
cʰ a ɴ ⁵⁵	cʰ j a ɴ ⁵⁵
ˀd ə ɴ ⁵⁵	ˀd w ɨ ɴ ⁵⁵
p l e ⁵⁵	p l e ⁵⁵
b r a ⁵⁵	b r a ⁵⁵
c ə ŋ ⁵⁵	c ə ŋ ⁵⁵
l o ⁵⁵	l o ⁵⁵
cʰ ɛ ŋ ⁵⁵	cʰ ɛ ŋ ⁵⁵
s i ⁵⁵	s ei ⁵⁵
p l ɔ ɴ ŋ ¹¹	p l ɔ ŋ ¹¹
k ə ⁰	ɲ̊ a ¹¹
r e ŋ ⁵⁵	r̥ e ŋ ⁵⁵
l o ŋ ¹¹	l̥ o ŋ ¹¹
ʔ o ¹¹	ʔ o ¹¹
kʰ a ¹¹	kʰ a ¹¹
pʰ ɔ ʔ̚ ⁵¹	pʰ ɔ ʔ̚ ⁵¹
ˀb u ⁵⁵	ˀb ə ⁵⁵
ˀb a ¹¹	ˀb a ¹¹
s r e ⁵⁵	s r e ³³
w a ¹¹	h w a ¹¹
d ɔ ŋ ŋ ¹¹	d ɔ ŋ ¹¹
t ə ʔ̚ ⁰	t ə ʔ̚ ⁰
ʔ e ¹¹	ʔ e ¹¹
k ə ⁵⁵	k ə ⁰
s ə ŋ ⁵⁵	s ə ŋ ⁵⁵
g l̥ ɛ ⁵⁵	k l ɛ ⁵⁵
b r e ʔ̚ ⁵¹	b r e ʔ̚ ⁵¹
pʰ e ⁵⁵	pʰ e ⁵⁵
c a ¹¹	ɟ a ¹¹
ˀb i ¹¹	ˀb i ¹¹
m u ¹¹	m u ¹¹
m l ɔ ⁵⁵	m l ɔ ɴ ⁵⁵
s r ɔ ¹¹	s r ɔ ¹¹
n e ŋ ¹¹	n̥ e ŋ ¹¹
ʔ̚ w i ¹¹	ʔ w i ¹¹
pʰ a ʔ̚ ⁵¹	p a ʔ̚ ⁵¹
l a ŋ ⁵⁵	l a ŋ ⁵⁵
m ə ŋ ¹¹	m ə ŋ ¹¹
tʰ au ⁵⁵	tʰ au ⁵⁵
w i ⁵⁵	w i ⁵⁵
m a ʔ̚ ⁵¹	m a ʔ̚ ⁵¹
k ə ¹¹	m ə ¹¹
cʰ a ʔ̚ ⁵¹	cʰ a ʔ̚ ⁵¹
m ɨ ¹¹	m ɨ ¹¹
tʰ ə ¹¹	tʰ ə ¹¹
cʰ a ¹¹	cʰ a ¹¹
l a ¹¹	l̥ a ¹¹
tʰ w a ɴ ¹¹	tʰ w a ɴ ¹¹
s u ɴ ¹¹	s u n ¹¹
d o ŋ ¹¹	d o ŋ ¹¹
kʰ w i ⁵⁵	kʰ w i ⁵⁵
r a ʔ̚ ⁵¹	r e ʔ̚ ⁵¹
d ɨ m ⁵⁵	d ɨ m ⁵⁵
ʔ ə ŋ ⁵⁵	ʔ ə ŋ ⁵⁵
kʰ i ŋ ⁵⁵	kʰ i ŋ ⁵⁵
k ə ⁵⁵	s u ⁵⁵
ˀd e ¹¹	ˀd e ¹¹
m ɨ ¹¹	m̥ ɨ ¹¹
tʰ w ɛ ⁵⁵	tʰ w ɛ ⁵⁵
ˀb ɔ ⁵⁵	ˀb ɔ ⁵⁵
m u ɴ ⁵⁵	m w ɨ ɴ ⁵⁵
ˀd e ⁵⁵	ˀd e ⁵⁵
d ɛ ʔ̚ ⁵¹	d ɛ ʔ̚ ⁵¹
s o ¹¹	s o ¹¹
l a ʔ̚ ⁵¹	l e ʔ̚ ⁵¹
r ɔ ⁵⁵	r ɔ ⁵⁵
n ɔ ʔ ⁵¹	n̥ ɔ ʔ̚ ⁵¹
k u ⁵⁵	k u ⁵⁵
tʰ ə ŋ ⁵⁵	tʰ ə ɴ ⁵⁵
r a ¹¹	r a ɴ ¹¹
j ə ɴ ¹¹	j ɨ m ¹¹
t a ŋ ⁵⁵	ˀb a ŋ ⁵⁵
r w i ⁵¹	r̥ w i ʔ̚ ⁵¹
b i ʔ̚ ⁵¹	p i ʔ̚ ⁵¹
n̥ ɨ m ⁵⁵	n ɨ m ⁵⁵
tʰ w i ¹¹	tʰ w i ¹¹
s w i ¹¹	ŋ w i ¹¹
tʰ a ʔ̚ ⁵¹	tʰ a ʔ̚ ⁵¹
l̥ l ɛ ⁵⁵	l w ɛ ⁵⁵
ʔ a n ⁵⁵	ʔ a ɴ ⁵⁵
b l i ʔ̚ ⁵¹	b l e ʔ ⁵¹
kʰ e ⁵⁵	kʰ e ⁵⁵
ʔ ɔ ɴ ŋ ¹¹	ʔ ɔ ɴ ¹¹
k ə ʔ̚ ⁰	k ə ʔ ⁰
l a ʔ̚ ⁵¹	s w a ʔ̚ ⁵¹
cʰ a ⁵⁵	c a ⁵⁵
j ɔ ʔ̚ ⁵¹	j ɔ ʔ̚ ⁵¹
l i ⁵⁵	l ei ⁵⁵
pʰ e ʔ̚ ⁵¹	pʰ e ʔ̚ ⁵¹
kʰ i ⁵⁵	kʰ ə ⁰
k ai ¹¹	n ei ¹¹
b i ¹¹	b i ¹¹
kʰ a ʔ̚ ⁵¹	kʰ a ʔ̚ ⁵¹
m j i ɴ ⁵⁵	m i n ⁵⁵
s ə ⁰	s ə ⁰
k ə t ⁵⁵	k o t ⁵⁵
kʰ a ŋ ¹¹	kʰ a ŋ ¹¹
s w i ¹¹	s w i ¹¹
k ə ⁰	k ə ⁰
l o ʔ̚ ⁵¹	l o ʔ̚ ⁵¹
k i ⁵⁵	k i ⁵⁵
k l ə ʔ̚ ⁵¹	k l ə ʔ̚ ⁵¹
r u ŋ ⁵⁵	r̥ u n ⁵⁵
tʰ u ¹¹	tʰ u ¹¹
cʰ ɨ m ⁵⁵	cʰ ɨ m ⁵⁵
n e ⁵⁵	n̥ e ⁵⁵
k ə ⁵⁵	ɲ̊ au ⁵⁵
b l e ⁵⁵	b l e ⁵⁵
r o ŋ ¹¹	r o ŋ ¹¹
ˀb ə ¹¹	ˀb ə ¹¹
p ə ŋ ¹¹	p ɨ ¹¹
tʰ a ¹¹	tʰ a ¹¹
m ei ¹¹	m̥ ei ¹¹
j o ⁵⁵	j o ⁵⁵
k a ɴ ⁵⁵	g a ŋ ⁵⁵
g o ¹¹	g o ¹¹
c u ⁵⁵	c u ⁵⁵
b ɔ ŋ ⁵⁵	b ɔ ŋ ⁵⁵
d ə ŋ ¹¹	d ə ŋ ¹¹
kʰ ei ⁵⁵	kʰ ei ⁵⁵
m a ¹¹	m̥ a ¹¹
l̥ o ⁵⁵	l̥ o ⁵⁵
ˀd ei ¹¹	ˀd ei ¹¹
j a ⁵⁵	r j a ⁵⁵
n i ⁵⁵	n̥ i ⁵⁵
k a ʔ̚ ⁰	k ə ʔ̚ ⁰
m a ŋ ¹¹	m a ŋ ¹¹
